https://www.smithsonianmag.com//smart-news/what-you-should-know-about-rare-covid-19-inflammation-syndrome-180974995/,Featured: How Is Kawasaki Disease Related to COVID-19?,SM,Smithsonian Magazine
https://www.smithsonianmag.com//science-nature/utahraptor-largest-raptor-180974954/,Featured: The Evolving Story of the Utahraptor,SM,Smithsonian Magazine
https://www.smithsonianmag.com//blogs/air-space-museum/2020/05/26/redefining-how-nasa-gets-space/,Featured: The Storied History Behind the SpaceX Launch,SM,Smithsonian Magazine
https://www.smithsonianmag.com//smithsonian-institution/our-stories-hawaii-180974981/,Featured: Young Hawaiians Digitally Document History,SM,Smithsonian Magazine
https://www.smithsonianmag.com//history/diarna-jewish-sites-not-seen-generations-visit-from-home-180974875/,Featured: Return to the Sacred,SM,Smithsonian Magazine
https://www.smithsonianmag.com//smithsonian-institution/mail-handlers-used-poke-holes-envelopes-battle-germs-and-viruses-180975020/,Featured: Poking Holes in the Mail to Ease Disease Anxiety,SM,Smithsonian Magazine
https://www.smithsonianmag.com//photos/17th-annual-photo-contest-finalists/,17th Annual Photo Contest Finalists Announced. Vote Now!,SM,Smithsonian Magazine
https://www.smithsonianmag.com//smart-news/why-pandemic-shaming-bad-public-health-180975425/,"Why 'Pandemic Shaming' Isn't Helpful
    
            Empathy may go further than annoyance when encouraging people to change their risky behavior",SM,Smithsonian Magazine
https://www.smithsonianmag.com//history/tracing-history-united-states-through-history-hurricanes-180975436/,"How Hurricanes Have Shaped U.S. History
    
            A new book examines the 500-year record of devastating storms affecting the nation's trajectory",SM,Smithsonian Magazine
https://www.smithsonianmag.com//smart-news/how-one-art-historian-discovered-exactly-where-van-gogh-painted-his-final-work-180975438/,"Where Did Vincent van Gogh Paint His Final Work? 
    
            The Dutch artist died 130 years ago today",SM,Smithsonian Magazine
https://www.smithsonianmag.com//smart-news/why-pandemic-shaming-bad-public-health-180975425/,"Why 'Pandemic Shaming' Isn't Helpful
    

            Empathy may go further than annoyance when encouraging people to change their risky behavior",SM,Smithsonian Magazine
https://www.smithsonianmag.com//history/tracing-history-united-states-through-history-hurricanes-180975436/,"How Hurricanes Have Shaped U.S. History
    

            A new book examines the 500-year record of devastating storms affecting the nation's trajectory",SM,Smithsonian Magazine
https://www.smithsonianmag.com//smart-news/how-one-art-historian-discovered-exactly-where-van-gogh-painted-his-final-work-180975438/,"Where Did Vincent van Gogh Paint His Final Work? 
    

            The Dutch artist died 130 years ago today",SM,Smithsonian Magazine
https://www.smithsonianmag.com//science-nature/researchers-discover-how-human-sperm-really-swim-180975453/,Researchers Discover How Human Sperm Really Swim,SM,Smithsonian Magazine
https://www.smithsonianmag.com//history/memes-1918-pandemic-180975452/,"How the 1918 Pandemic Got Meme-ified in Jokes, Songs and Poems",SM,Smithsonian Magazine
https://www.smithsonianmag.com//smithsonian-institution/20th-century-slavery-california-sweatshop-was-hiding-plain-sight-180975441/,20th-Century Slavery in a California Sweatshop Was Hiding in Plain Sight,SM,Smithsonian Magazine
https://www.smithsonianmag.com//science-nature/how-much-dogs-intelligence-hereditary-180975448/,What a Crowdsourced Study Taught Us About How Dogs Learn,SM,Smithsonian Magazine
https://www.smithsonianmag.com//blogs/smithsonian-associates/2020/07/26/exploring-underwater-caves-and-22-other-smithsonian-associates-programs-streaming-august/,Exploring Underwater Caves and 22 Other Smithsonian Programs Streaming in August,SM,Smithsonian Magazine
https://www.smithsonianmag.com//history/100-years-women-ballot-box-180975366/,100 Years of Women at the Ballot Box,SM,Smithsonian Magazine
https://www.smithsonianmag.com//history/what-first-women-voters-experienced-when-registering-1920-election-180975435/,What the First Women Voters Experienced When Registering for the 1920 Election,SM,Smithsonian Magazine
https://www.smithsonianmag.com//smithsonian-institution/why-aircraft-dropped-first-atomic-bomb-will-always-inspire-debate-180975421/,Why the Aircraft That Dropped the First Atomic Bomb Will Always Inspire Debate,SM,Smithsonian Magazine
https://www.smithsonianmag.com//travel/leader-accessible-design-us-olympic-paralympic-museum-opens-colorado-springs-180975412/,"A Champion in Accessible Design, the U.S. Olympic and Paralympic Museum Opens in Colorado Springs",SM,Smithsonian Magazine
https://www.smithsonianmag.com//history/tracing-history-united-states-through-history-hurricanes-180975436/,How Hurricanes Have Shaped the Course of U.S. History,SM,Smithsonian Magazine
https://www.smithsonianmag.com//blogs/air-space-museum/2020/07/28/mars-rover-perseverance/,Why NASA Is Headed Back to Mars With the Rover Perseverance,SM,Smithsonian Magazine
https://www.smithsonianmag.com//science-nature/nasa-launching-instrument-make-oxygen-mars-180975430/,"To Make Oxygen on Mars, NASA's Perseverance Rover Needs MOXIE",SM,Smithsonian Magazine
https://www.smithsonianmag.com//smithsonian-institution/what-does-smithsonian-look-post-covid-era-180975417/,What Does the Smithsonian Look Like in the Post-COVID Era?,SM,Smithsonian Magazine
https://www.smithsonianmag.com//travel/how-build-sandcastle-180975406/,How to Build a Sandcastle,SM,Smithsonian Magazine
https://www.smithsonianmag.com//blogs/national-museum-american-indian/2020/07/27/native-remembrance-korean-armistice/,A Native Remembrance on Korean Armistice Day,SM,Smithsonian Magazine
https://www.smithsonianmag.com//science-nature/how-a-public-health-campaign-warsaw-ghetto-stemmed-spread-typhus-180975418/,How a Public Health Campaign in the Warsaw Ghetto Stemmed the Spread of Typhus,SM,Smithsonian Magazine
https://www.smithsonianmag.com//videos/category/history/smithsonian-secretary-lonnie-bunch-on-the-hi/,Smithsonian Secretary Lonnie Bunch on the History of Protest in America,SM,Smithsonian Magazine
https://www.smithsonianmag.com//innovation/in-social-insects-researchers-find-clues-battling-pandemics-180975402/,"In Social Insects, Researchers Find Clues for Battling Pandemics",SM,Smithsonian Magazine
https://www.smithsonianmag.com//history/history-30-years-since-signing-americans-disabilities-act-180975409/,"The ADA Was a Monumental Achievement 30 Years Ago, but the Fight for Equal Rights Continues",SM,Smithsonian Magazine
https://www.smithsonianmag.com//travel/this-frank-lloyd-wright-home-was-trailblazing-example-accessible-design-180975383/,This Frank Lloyd Wright Home Was a Trailblazing Example of Accessible Design,SM,Smithsonian Magazine
https://www.smithsonianmag.com//smart-news/cape-cod-island-open-public-first-time-300-years-180975457/,Cape Cod Island Opens to the Public for the First Time in 300 Years,SM,Smithsonian Magazine
https://www.smithsonianmag.com//smart-news/Anglerfish-Drop-Their-Immune-Defenses-to-Find-Love-180975458/,Anglerfish Drop Their Immune Defenses to Find Love,SM,Smithsonian Magazine
https://www.smithsonianmag.com//smart-news/vacinnation-smallpox-civil-war-180975428/,Civil War-Era Vaccination Kits Yield New Clues About History of Smallpox Vaccine,SM,Smithsonian Magazine
https://www.smithsonianmag.com//smart-news/peat-bogs-arent-preserving-ancient-bones-well-they-used-180975449/,Study Suggests Bones Preserved in Peat Bogs May Be at Risk,SM,Smithsonian Magazine
https://www.smithsonianmag.com//smart-news/marsupial-saber-tooth-was-no-killer-cat-180975442/,This Marsupial Sabertooth Was No Killer Cat,SM,Smithsonian Magazine
https://www.smithsonianmag.com//smart-news/origin-stonehenges-massive-boulders-revealed-180975450/,Archaeologists Pinpoint Origins of Stonehenge's Mysterious Megaliths,SM,Smithsonian Magazine
https://www.smithsonianmag.com//smart-news/moma-urges-norwegian-government-preserve-site-picasso-murals-180974874/,"Norway Tears Down Picasso Mural After Years of Debate Between Authorities, Activists",SM,Smithsonian Magazine
https://www.smithsonianmag.com//smart-news/ghent-altarpiece-restorations-reveal-alarmingly-humanoid-face-famous-mystical-lamb-180973846/,New Research on the Ghent Altarpiece Validates Restorers' Rendering of the Mystic Lamb's Alarmingly Humanoid Face,SM,Smithsonian Magazine
https://www.smithsonianmag.com//smart-news/trees-live-thousands-years-can-they-cheat-death-180975433/,"Trees Live for Thousands of Years, but Can They Cheat Death? Not Quite",SM,Smithsonian Magazine
https://www.smithsonianmag.com//smart-news/explore-historical-brooklyn-these-newly-digitized-maps-180975447/,Explore Centuries of Brooklyn's History With These Newly Digitized Maps,SM,Smithsonian Magazine
https://www.smithsonianmag.com//smart-news/3-things-look-forward-when-perseverance-reaches-mars-180975446/,Here Are Three Things the Perseverence Rover Will Do When It Gets to Mars,SM,Smithsonian Magazine
https://www.smithsonianmag.com//smart-news/pair-mini-mummies-contain-non-human-remains-180975443/,CT Scans Reveal Miniature Mummies' Surprising Contents,SM,Smithsonian Magazine
https://www.smithsonianmag.com//history/memes-1918-pandemic-180975452/,"How the 1918 Pandemic Got Meme-ified in Jokes, Songs and Poems",SM,Smithsonian Magazine
https://www.smithsonianmag.com//smithsonian-institution/20th-century-slavery-california-sweatshop-was-hiding-plain-sight-180975441/,20th-Century Slavery in a California Sweatshop Was Hiding in Plain Sight,SM,Smithsonian Magazine
https://www.smithsonianmag.com//science-nature/researchers-discover-how-human-sperm-really-swim-180975453/,Researchers Discover How Human Sperm Really Swim,SM,Smithsonian Magazine
https://www.smithsonianmag.com//science-nature/how-much-dogs-intelligence-hereditary-180975448/,What a Crowdsourced Study Taught Us About How Dogs Learn,SM,Smithsonian Magazine
https://www.smithsonianmag.com//blogs/smithsonian-associates/2020/07/26/exploring-underwater-caves-and-22-other-smithsonian-associates-programs-streaming-august/,Exploring Underwater Caves and 22 Other Smithsonian Programs Streaming in August,SM,Smithsonian Magazine
https://www.smithsonianmag.com//blogs/smithsonian-associates/2020/07/26/exploring-underwater-caves-and-22-other-smithsonian-associates-programs-streaming-august/,Exploring Underwater Caves and 22 Other Smithsonian Programs Streaming in August,SM,Smithsonian Magazine
https://www.smithsonianmag.com//blogs/air-space-museum/2020/07/28/mars-rover-perseverance/,Why NASA Is Headed Back to Mars With the Rover Perseverance,SM,Smithsonian Magazine
https://www.smithsonianmag.com//travel/how-build-sandcastle-180975406/,How to Build a Sandcastle,SM,Smithsonian Magazine
https://www.smithsonianmag.com//photocontest/photo-of-the-day/2020-08-02/cool-lighting-and-cooler-temperatures/,"Cool Lighting and Cooler Temperatures
Photo of the Day»",SM,Smithsonian Magazine
https://www.smithsonianmag.com//smart-news/peat-bogs-arent-preserving-ancient-bones-well-they-used-180975449/,Study Suggests Bones Preserved in Peat Bogs May Be at Risk,SM,Smithsonian Magazine
https://www.smithsonianmag.com//smart-news/if-you-looked-out-window-while-returning-space-heres-what-youd-see-180953613/,"If You Looked Out the Window While Returning From Space, Here’s What You’d See",SM,Smithsonian Magazine
https://www.smithsonianmag.com//science-nature/researchers-discover-how-human-sperm-really-swim-180975453/,Researchers Discover How Human Sperm Really Swim,SM,Smithsonian Magazine
https://www.smithsonianmag.com//smart-news/petite-cat-worlds-deadliest-killing-more-prey-single-night-leopard-does-six-months-180970695/,This Petite Cat Is the World's Deadliest. Mini-Series 'Super Cats' Shows You Why,SM,Smithsonian Magazine
https://www.smithsonianmag.com//history/why-19th-century-axe-murderer-lizzie-borden-was-found-not-guilty-180972707/,Why 19th-Century Axe Murderer Lizzie Borden Was Found Not Guilty,SM,Smithsonian Magazine
https://www.smithsonianmag.com//science-nature/everything-you-wanted-to-know-about-dinosaur-sex-173015/,Everything You Wanted to Know About Dinosaur Sex,SM,Smithsonian Magazine
https://www.smithsonianmag.com//smart-news/lizzie-borden-didnt-kill-her-parents-maybe-180963721/,Lizzie Borden Didn’t Kill Her Parents (Maybe),SM,Smithsonian Magazine
https://www.smithsonianmag.com//science-nature/14-fun-facts-about-dragonflies-96882693/,14 Fun Facts About Dragonflies,SM,Smithsonian Magazine
https://www.smithsonianmag.com//smart-news/origin-stonehenges-massive-boulders-revealed-180975450/,Archaeologists Pinpoint Origins of Stonehenge's Mysterious Megaliths,SM,Smithsonian Magazine
https://www.smithsonianmag.com//science-nature/europe-bog-bodies-reveal-secrets-180962770/,Europe's Famed Bog Bodies Are Starting to Reveal Their Secrets,SM,Smithsonian Magazine
https://www.smithsonianmag.com//history/true-story-behind-greyhound-movie-180975077/,The True Story Behind Tom Hanks' 'Greyhound' Movie,SM,Smithsonian Magazine
https://www.smithsonianmag.com//smart-news/neanderthals-may-have-been-more-sensitive-pain-most-humans-180975424/,Neanderthals May Have Been More Sensitive to Pain Than Most Humans,SM,Smithsonian Magazine
https://www.smithsonianmag.com//science-nature/14-fun-facts-about-love-and-sex-animal-kingdom-180974205/,Fourteen Fun Facts About Love and Sex in the Animal Kingdom,SM,Smithsonian Magazine
https://www.smithsonianmag.com//smart-news/pair-mini-mummies-contain-non-human-remains-180975443/,CT Scans Reveal Miniature Mummies' Surprising Contents,SM,Smithsonian Magazine
https://www.smithsonianmag.com/reader-service/?utm_medium=homepagepromo&utm_campaign=Marketplace,FREE INFO FROM ADVERTISERS »,SM,Smithsonian Magazine
https://www.smithsonianmag.com//videos/category/history/einsteins-life-in-america-shown-in-stunning/,Einstein’s Life in America Shown in Stunning Home Movies,SM,Smithsonian Magazine
https://www.smithsonianmag.com//videos/category/arts-culture/the-1919-world-series-fix-that-tarnished-ame/,The 1919 World Series Fix That Tarnished America's Pastime,SM,Smithsonian Magazine
https://www.smithsonianmag.com//videos/category/history/ed-dwight-jr-was-set-to-become-americas-fi/,Ed Dwight Jr. Was Set to Become America’s First Black Astronaut,SM,Smithsonian Magazine
https://www.smithsonianmag.com//videos/category/history/this-burial-site-near-stonehenge-was-packed/,This Burial Site Near Stonehenge Was Packed With Arrows,SM,Smithsonian Magazine
https://www.smithsonianmag.com//videos/category/arts-culture/smithsonian-american-ingenuity-awards-2019-_2/,Smithsonian American Ingenuity Awards 2019: Lil Nas X,SM,Smithsonian Magazine
https://www.smithsonianmag.com//videos/category/history/why-plague-doctors-wore-strange-masks/,Why Plague Doctors Wore Strange Masks,SM,Smithsonian Magazine
https://www.smithsonianmag.com//science-nature/bonobos-teach-humans-about-nature-language-180975191/,What Can Bonobos Teach Us About the Nature of Language?,SM,Smithsonian Magazine
https://www.smithsonianmag.com//history/american-descendants-180975155/,These Portraits Revisit the Legacies of Famous Americans,SM,Smithsonian Magazine
https://www.smithsonianmag.com//science-nature/scientists-hunt-viruses-animals-before-strike-humans-180975081/,These Scientists Hunt for Viruses in Animals Before They Strike Humans,SM,Smithsonian Magazine
https://www.smithsonianmag.com//about/smithsonian-opt-out-choices/,California Do Not Sell My Info,SM,Smithsonian Magazine
