https://www.space.com/,"space
Created with Sketch.


















Space",space,Space.com
https://www.space.com/your-favorite-magazines-space-science-deal-discount.html,"Subscribe to ""All About Space"" Magazine!",space,Space.com
https://www.space.com/your-favorite-magazines-space-science-deal-discount.html,45% Off 'All About Space'!,space,Space.com
https://www.space.com/spacex-demo2-astronauts-prepared-for-splashdown-seasickness.html,The 1st NASA astronauts to come home on SpaceX's Crew Dragon are ready for anything. Even seasickness.,space,Space.com
https://www.space.com/mars-rover-perseverance-is-fine-exits-safe-mode.html,"NASA's Mars rover Perseverance is fine and out of 'safe mode'
The life-hunting rover bounced back fast.",space,Space.com
https://www.space.com/spacex-crew-dragon-demo-2-test-flight-explained.html,SpaceX's historic Demo-2 Crew Dragon astronaut test flight: Full coverage,space,Space.com
https://www.space.com/weird-long-mars-cloud-is-back.html,"A weird long cloud on Mars has returned. It's right on schedule, scientists say.
It's baaaaaaack …",space,Space.com
https://www.space.com/spacex-crew-dragon-demo-2-astronauts-splaashdown-webcast.html,SpaceX to return NASA astronauts to Earth for the 1st time today. You can watch it live.,space,Space.com
https://www.space.com/spacex-crew-dragon-demo-2-test-flight-explained.html,SpaceX's historic Demo-2 Crew Dragon astronaut test flight: Full coverage,space,Space.com
https://www.space.com/17933-nasa-television-webcasts-live-space-tv.html,Watch live: SpaceX Crew Dragon heading home with 1st NASA crew,space,Space.com
https://www.space.com/space-force-space-horse.html,US Space Force hires a horse to boldly go where rockets can't. (The beach),space,Space.com
https://www.space.com/pentagon-ufo-agency-still-active.html,"Pentagon's secret, defunct UFO-hunting program may still exist",space,Space.com
